{"artifact_schema_version":"pipeline_run_artifact.v1","carry_through_hashes":{"calibration_hash":"4f53cda18c2baa0c0354bb5f9a3ecbe5ed12ab4d8e11ba873c2f11161202b945","dataset_hash":"4f53cda18c2baa0c0354bb5f9a3ecbe5ed12ab4d8e11ba873c2f11161202b945","decision_payload_hash":"da4b96b3b10807cb8eba7076c4fafe4d459a784e0b9175b937a2c73b485c0dfc","decision_policy_hash":null,"forecast_payload_hash":"4f53cda18c2baa0c0354bb5f9a3ecbe5ed12ab4d8e11ba873c2f11161202b945","model_hash":"5fefc094e744f012e566c8ecad5bf2331b43068d1c65056af8d72a621d6fa7de","trade_plan_payload_hash":"34e0c3a8826c29047c92191be8fbb557f09387afeff135ed1ee14c533a988859","uncertainty_hash":"4f53cda18c2baa0c0354bb5f9a3ecbe5ed12ab4d8e11ba873c2f11161202b945"},"code_version":"93e488b02086","config_hash":"24e442b6b82cf5ea3e5ca258bbf950b7ee40a39003be375b10cf7662d4032bc9","generated_at_utc":"2026-03-10T00:00:00+00:00","inputs":{"forecast_artifact_hash":"4f53cda18c2baa0c0354bb5f9a3ecbe5ed12ab4d8e11ba873c2f11161202b945","forecast_artifact_path":"C:\\Users\\AuslFe\\Desktop\\PROBITY\\artifacts\\forecasts\\239d1cd6e6db5370a62663353ea4ded4.json","forecast_run_id":"239d1cd6e6db5370a62663353ea4ded4"},"kpis":{"n_decisions":0,"n_orders":0,"n_positions":0,"n_rejected":0,"total_notional_usd":{"executed":0.0,"planned":0.0},"unrealized_pnl_usd":0.0},"outputs":{"decision":{"artifact_path":"artifacts\\decisions\\255b7d38448c54f38811dec253bef195.json","decision_items_hash":"4f53cda18c2baa0c0354bb5f9a3ecbe5ed12ab4d8e11ba873c2f11161202b945","payload_hash":"da4b96b3b10807cb8eba7076c4fafe4d459a784e0b9175b937a2c73b485c0dfc","policy_hash":"2074697f10612fbec37d249bd72edd06c0c622b98c264c2bf117fc79e9c26d55","run_id":"255b7d38448c54f38811dec253bef195"},"execution":{"artifact_path":"artifacts\\executions\\9cf834bc3f7c5103bde23c946be43b97.json","orders_hash":"4f53cda18c2baa0c0354bb5f9a3ecbe5ed12ab4d8e11ba873c2f11161202b945","payload_hash":"7c48486511804d057e0aa10f3a1e9e0c2be4817d3fbbb709361c0fc3042dc629","policy_hash":"e71a4c6011253fd6715d40fe332811583f9a530f63abf309f1ede24956c1865a","run_id":"9cf834bc3f7c5103bde23c946be43b97"},"portfolio":{"artifact_path":"artifacts\\portfolios\\6f42763de453501d9bb460ca9b008cd9.json","ledger_hash":"4f53cda18c2baa0c0354bb5f9a3ecbe5ed12ab4d8e11ba873c2f11161202b945","payload_hash":"57a8ecac6bd1647d77308dde272092731f977f9edb845826713f1bacdcbbe803","policy_hash":"b6199eaaa45dd159696d821fa9b8c9464f42cd0cd1a108475d0877728794097e","positions_hash":"4f53cda18c2baa0c0354bb5f9a3ecbe5ed12ab4d8e11ba873c2f11161202b945","run_id":"6f42763de453501d9bb460ca9b008cd9","valuation_hash":"915be4968aa94c4bdd2e3fb927e6c2813327cf54c95e95227ace34cb2051538b"},"trade_plan":{"artifact_path":"artifacts\\trade_plans\\bd362872ede5592c9f0ed74664867077.json","orders_hash":"4f53cda18c2baa0c0354bb5f9a3ecbe5ed12ab4d8e11ba873c2f11161202b945","payload_hash":"34e0c3a8826c29047c92191be8fbb557f09387afeff135ed1ee14c533a988859","policy_hash":"d58c1a0453df9f6a0e4ca970646c714f1a4c84a792d0ffd82ee1d3ef03f79fbd","run_id":"bd362872ede5592c9f0ed74664867077"}},"pipeline_outputs_hash":"b769c6a5ff51d80f3e34148847abd98cc025c78c5e1f49942d16315d09aa5619","pipeline_payload_hash":"6b16ebdaeadbb283b418edc0ed7597afba99a3fccc9d650ca6903fe39ce4d7ca","pipeline_policy_hash":"a3838416baf618b27a402d7cb47ee9657cb6139d8554517475eaae669b2646d5","pipeline_policy_version":"pipeline_stub.v1","quality_flags":["coverage_below_target_50","coverage_below_target_90","insufficient_calibration_data","insufficient_uncertainty_data"],"quality_warnings":[{"code":"coverage_below_target_50","message":"Observed 50% interval coverage below target.","source":"forecast"},{"code":"coverage_below_target_90","message":"Observed 90% interval coverage below target.","source":"forecast"},{"code":"insufficient_calibration_data","message":"Calibration quality gate: insufficient eval sample size.","source":"forecast"},{"code":"insufficient_uncertainty_data","message":"Uncertainty report has insufficient sample size.","source":"forecast"}],"run_id":"04043fe14acc58c3a864569edd216c61"}