{"artifact_schema_version":"pipeline_run_artifact.v1","carry_through_hashes":{"calibration_hash":"4f53cda18c2baa0c0354bb5f9a3ecbe5ed12ab4d8e11ba873c2f11161202b945","dataset_hash":"4f53cda18c2baa0c0354bb5f9a3ecbe5ed12ab4d8e11ba873c2f11161202b945","decision_payload_hash":"95efaaf00abf1b52b9c7641fb14abfdc3cc391b8f6a05946aa1313760bda0bc3","decision_policy_hash":null,"forecast_payload_hash":"4f53cda18c2baa0c0354bb5f9a3ecbe5ed12ab4d8e11ba873c2f11161202b945","model_hash":"5fefc094e744f012e566c8ecad5bf2331b43068d1c65056af8d72a621d6fa7de","trade_plan_payload_hash":"80358cdfbc88107c705eb9514070e60d234d355bbd563c25486925735ae18566","uncertainty_hash":"4f53cda18c2baa0c0354bb5f9a3ecbe5ed12ab4d8e11ba873c2f11161202b945"},"code_version":"93e488b02086","config_hash":"45c253764827b8e77ed8def40cb25aacfb70c8ead310774662aa6a183818a577","generated_at_utc":"2026-02-16T06:22:13+00:00","inputs":{"forecast_artifact_hash":"4f53cda18c2baa0c0354bb5f9a3ecbe5ed12ab4d8e11ba873c2f11161202b945","forecast_artifact_path":"C:\\Users\\AuslFe\\Desktop\\PROBITY\\artifacts\\forecasts\\916a36568aa957fa9695fa7efbc244c9.json","forecast_run_id":"916a36568aa957fa9695fa7efbc244c9"},"kpis":{"n_decisions":0,"n_orders":0,"n_positions":0,"n_rejected":0,"total_notional_usd":{"executed":0.0,"planned":0.0},"unrealized_pnl_usd":0.0},"outputs":{"decision":{"artifact_path":"artifacts\\decisions\\fbceffc87eb65dc3af7c9cd528b4e62b.json","decision_items_hash":"4f53cda18c2baa0c0354bb5f9a3ecbe5ed12ab4d8e11ba873c2f11161202b945","payload_hash":"95efaaf00abf1b52b9c7641fb14abfdc3cc391b8f6a05946aa1313760bda0bc3","policy_hash":"2074697f10612fbec37d249bd72edd06c0c622b98c264c2bf117fc79e9c26d55","run_id":"fbceffc87eb65dc3af7c9cd528b4e62b"},"execution":{"artifact_path":"artifacts\\executions\\fb817b2cc36059d8b0a40cd6184952e4.json","orders_hash":"4f53cda18c2baa0c0354bb5f9a3ecbe5ed12ab4d8e11ba873c2f11161202b945","payload_hash":"4857b2319b50a20ba373794c233671344ebaf4efc1e6abf41d3fa8db08c14da0","policy_hash":"e71a4c6011253fd6715d40fe332811583f9a530f63abf309f1ede24956c1865a","run_id":"fb817b2cc36059d8b0a40cd6184952e4"},"portfolio":{"artifact_path":"artifacts\\portfolios\\549b6723f82657efa8528050551c2671.json","ledger_hash":"4f53cda18c2baa0c0354bb5f9a3ecbe5ed12ab4d8e11ba873c2f11161202b945","payload_hash":"da4c05cb127113de6fef2c531212a1f8aaac911c366d539642d0ce67348203be","policy_hash":"b6199eaaa45dd159696d821fa9b8c9464f42cd0cd1a108475d0877728794097e","positions_hash":"4f53cda18c2baa0c0354bb5f9a3ecbe5ed12ab4d8e11ba873c2f11161202b945","run_id":"549b6723f82657efa8528050551c2671","valuation_hash":"915be4968aa94c4bdd2e3fb927e6c2813327cf54c95e95227ace34cb2051538b"},"trade_plan":{"artifact_path":"artifacts\\trade_plans\\c99c7552207c5d2d8fd4cc79f77d828d.json","orders_hash":"4f53cda18c2baa0c0354bb5f9a3ecbe5ed12ab4d8e11ba873c2f11161202b945","payload_hash":"80358cdfbc88107c705eb9514070e60d234d355bbd563c25486925735ae18566","policy_hash":"d58c1a0453df9f6a0e4ca970646c714f1a4c84a792d0ffd82ee1d3ef03f79fbd","run_id":"c99c7552207c5d2d8fd4cc79f77d828d"}},"pipeline_outputs_hash":"2b61ec00d104af07103a3af765ef7d613179fca9145aebce057b353df17d3d06","pipeline_payload_hash":"7173b40fbe1bab5c56dbe3c2989beec1101994f69c60da6e638d35dcd5e90e33","pipeline_policy_hash":"a3838416baf618b27a402d7cb47ee9657cb6139d8554517475eaae669b2646d5","pipeline_policy_version":"pipeline_stub.v1","quality_flags":["coverage_below_target_50","coverage_below_target_90","insufficient_calibration_data","insufficient_uncertainty_data"],"quality_warnings":[{"code":"coverage_below_target_50","message":"Observed 50% interval coverage below target.","source":"forecast"},{"code":"coverage_below_target_90","message":"Observed 90% interval coverage below target.","source":"forecast"},{"code":"insufficient_calibration_data","message":"Calibration quality gate: insufficient eval sample size.","source":"forecast"},{"code":"insufficient_uncertainty_data","message":"Uncertainty report has insufficient sample size.","source":"forecast"}],"run_id":"1d091c81eef1541ebacd9d6ba2180f6f"}