{"artifact_schema_version":"pipeline_run_artifact.v1","carry_through_hashes":{"calibration_hash":"cccccccccccccccccccccccccccccccccccccccccccccccccccccccccccccccc","dataset_hash":"bbbbbbbbbbbbbbbbbbbbbbbbbbbbbbbbbbbbbbbbbbbbbbbbbbbbbbbbbbbbbbbb","decision_payload_hash":"491ab75101fda028430cf92023c41f34786fc3b6bb74b4cd8e4efb854644c831","decision_policy_hash":null,"forecast_payload_hash":"ffffffffffffffffffffffffffffffffffffffffffffffffffffffffffffffff","model_hash":"9999999999999999999999999999999999999999999999999999999999999999","trade_plan_payload_hash":"3d974a9e5a6abf98a495442e7432547691d9026c6f7906540f92b39d08d1956a","uncertainty_hash":"eeeeeeeeeeeeeeeeeeeeeeeeeeeeeeeeeeeeeeeeeeeeeeeeeeeeeeeeeeeeeeee"},"code_version":"93e488b02086","config_hash":"5d455c383bc62644856afe69193e85fa032eb04b230ed548e3887789dffa903a","generated_at_utc":"2026-02-01T00:00:00+00:00","inputs":{"forecast_artifact_hash":"ffffffffffffffffffffffffffffffffffffffffffffffffffffffffffffffff","forecast_artifact_path":"tests\\fixtures\\forecast\\forecast_artifact_sample.json","forecast_run_id":"forecast-run-sample"},"kpis":{"n_decisions":6,"n_orders":3,"n_positions":3,"n_rejected":0,"total_notional_usd":{"executed":75.0,"planned":75.0},"unrealized_pnl_usd":0.0},"outputs":{"decision":{"artifact_path":"artifacts\\decisions\\5caa8583201f5980873a15394692519a.json","decision_items_hash":"68fbd141feb9d08a1343295625be3a1bfb0e6aab5c3b1d1fb00007e7ebb3692e","payload_hash":"491ab75101fda028430cf92023c41f34786fc3b6bb74b4cd8e4efb854644c831","policy_hash":"2074697f10612fbec37d249bd72edd06c0c622b98c264c2bf117fc79e9c26d55","run_id":"5caa8583201f5980873a15394692519a"},"execution":{"artifact_path":"artifacts\\executions\\185e739121885a998fc39eb17bf6efee.json","orders_hash":"38dbac8b531caad868094ff91af992de7c9ffc5ac29f6087be3b49d13cf6faa6","payload_hash":"105179ca594a1bc1d5232033e32733981cdd122174ef5c87e86a553f65fc9f28","policy_hash":"e71a4c6011253fd6715d40fe332811583f9a530f63abf309f1ede24956c1865a","run_id":"185e739121885a998fc39eb17bf6efee"},"portfolio":{"artifact_path":"artifacts\\portfolios\\6ce68484b3505454998719857f47b4f2.json","ledger_hash":"c25f91ea12eff8fd28e50409dd37382aa7ce42ab38a9061b9d97150667f485b2","payload_hash":"7c48d1a2633e376bd002b22c6e412f3e006735c773d217a5a5074665df38b719","policy_hash":"b6199eaaa45dd159696d821fa9b8c9464f42cd0cd1a108475d0877728794097e","positions_hash":"aab70ae067c4f78dacef45b9a800c1d747d9682215dd14fba9e0c97b504eda86","run_id":"6ce68484b3505454998719857f47b4f2","valuation_hash":"4adbb20db3edba6c6e8d661a0e59da118268e5a6fb956c60caf33935f6c62a8d"},"trade_plan":{"artifact_path":"artifacts\\trade_plans\\8e7da4a9d9f15eba81539f677975749e.json","orders_hash":"eabc5e92fc7d9823e5373dc8f75373f5a5149d3bd44cd6ae99a0b0e46df2bf47","payload_hash":"3d974a9e5a6abf98a495442e7432547691d9026c6f7906540f92b39d08d1956a","policy_hash":"d58c1a0453df9f6a0e4ca970646c714f1a4c84a792d0ffd82ee1d3ef03f79fbd","run_id":"8e7da4a9d9f15eba81539f677975749e"}},"pipeline_outputs_hash":"c1f03f9d69d9396d82c003206e38496a5d5a384cef260f18e24eeeca7ece21a2","pipeline_payload_hash":"e58a6218df51e33f5a593fe159f7aff6922fc7ea9bcac21ee7f86c50510014b0","pipeline_policy_hash":"a3838416baf618b27a402d7cb47ee9657cb6139d8554517475eaae669b2646d5","pipeline_policy_version":"pipeline_stub.v1","quality_flags":["illiquid"],"quality_warnings":[{"code":"illiquid","message":"Top depth below threshold.","source":"decision_item"},{"code":"illiquid","message":"Top depth below threshold.","source":"execution_skipped"},{"code":"illiquid","message":"Top depth below threshold.","source":"trade_plan_skipped"}],"run_id":"aa79e5253c2d5c82844cf57c039f6a86"}