{"artifact_schema_version":"pipeline_run_artifact.v1","carry_through_hashes":{"calibration_hash":"4f53cda18c2baa0c0354bb5f9a3ecbe5ed12ab4d8e11ba873c2f11161202b945","dataset_hash":"4f53cda18c2baa0c0354bb5f9a3ecbe5ed12ab4d8e11ba873c2f11161202b945","decision_payload_hash":"2b86d00e3cc2941454d6065b4e265272a174f9037f1334b15c7fed82763cdfa9","decision_policy_hash":null,"forecast_payload_hash":"4f53cda18c2baa0c0354bb5f9a3ecbe5ed12ab4d8e11ba873c2f11161202b945","model_hash":"5fefc094e744f012e566c8ecad5bf2331b43068d1c65056af8d72a621d6fa7de","trade_plan_payload_hash":"421b19ba7baf72161456164a0d5985767339ccc2e1f534819f7e4d44f3e23c25","uncertainty_hash":"4f53cda18c2baa0c0354bb5f9a3ecbe5ed12ab4d8e11ba873c2f11161202b945"},"code_version":"93e488b02086","config_hash":"5212fc207f8a49791cdacb4ba8cad6948204c282ffe325d5a1e95c49a1f258bd","generated_at_utc":"2026-02-16T06:22:13+00:00","inputs":{"forecast_artifact_hash":"4f53cda18c2baa0c0354bb5f9a3ecbe5ed12ab4d8e11ba873c2f11161202b945","forecast_artifact_path":"artifacts\\forecasts\\916a36568aa957fa9695fa7efbc244c9.json","forecast_run_id":"916a36568aa957fa9695fa7efbc244c9"},"kpis":{"n_decisions":0,"n_orders":0,"n_positions":0,"n_rejected":0,"total_notional_usd":{"executed":0.0,"planned":0.0},"unrealized_pnl_usd":0.0},"outputs":{"decision":{"artifact_path":"artifacts\\decisions\\3e91568526875452b154bcbbff3e232d.json","decision_items_hash":"4f53cda18c2baa0c0354bb5f9a3ecbe5ed12ab4d8e11ba873c2f11161202b945","payload_hash":"2b86d00e3cc2941454d6065b4e265272a174f9037f1334b15c7fed82763cdfa9","policy_hash":"2074697f10612fbec37d249bd72edd06c0c622b98c264c2bf117fc79e9c26d55","run_id":"3e91568526875452b154bcbbff3e232d"},"execution":{"artifact_path":"artifacts\\executions\\564486a746ab5960ba0287c8c8c319f4.json","orders_hash":"4f53cda18c2baa0c0354bb5f9a3ecbe5ed12ab4d8e11ba873c2f11161202b945","payload_hash":"39a10bf23933756a6fd48bfe9cd74a7d45a2cdc63f66fc91fbbde5410f7a6f2a","policy_hash":"e71a4c6011253fd6715d40fe332811583f9a530f63abf309f1ede24956c1865a","run_id":"564486a746ab5960ba0287c8c8c319f4"},"portfolio":{"artifact_path":"artifacts\\portfolios\\500b1f18999652f7a341450d49242e59.json","ledger_hash":"4f53cda18c2baa0c0354bb5f9a3ecbe5ed12ab4d8e11ba873c2f11161202b945","payload_hash":"f617a0d5d4312ebef6e83b61f339a30b524795f3bc5397ba5b2a8b477d812b8f","policy_hash":"b6199eaaa45dd159696d821fa9b8c9464f42cd0cd1a108475d0877728794097e","positions_hash":"4f53cda18c2baa0c0354bb5f9a3ecbe5ed12ab4d8e11ba873c2f11161202b945","run_id":"500b1f18999652f7a341450d49242e59","valuation_hash":"915be4968aa94c4bdd2e3fb927e6c2813327cf54c95e95227ace34cb2051538b"},"trade_plan":{"artifact_path":"artifacts\\trade_plans\\4dd16d5b7dec55d180b7c05b53c949f8.json","orders_hash":"4f53cda18c2baa0c0354bb5f9a3ecbe5ed12ab4d8e11ba873c2f11161202b945","payload_hash":"421b19ba7baf72161456164a0d5985767339ccc2e1f534819f7e4d44f3e23c25","policy_hash":"d58c1a0453df9f6a0e4ca970646c714f1a4c84a792d0ffd82ee1d3ef03f79fbd","run_id":"4dd16d5b7dec55d180b7c05b53c949f8"}},"pipeline_outputs_hash":"8eb5b0694746753ed0e52998ec457367bba0a1a252d0e0fd45ce4b2b98ddc97b","pipeline_payload_hash":"ee103b8f3c1977b6a42fbe4cd5c8eef1f8206525bca2df422d15598ed014e245","pipeline_policy_hash":"a3838416baf618b27a402d7cb47ee9657cb6139d8554517475eaae669b2646d5","pipeline_policy_version":"pipeline_stub.v1","quality_flags":["coverage_below_target_50","coverage_below_target_90","insufficient_calibration_data","insufficient_uncertainty_data"],"quality_warnings":[{"code":"coverage_below_target_50","message":"Observed 50% interval coverage below target.","source":"forecast"},{"code":"coverage_below_target_90","message":"Observed 90% interval coverage below target.","source":"forecast"},{"code":"insufficient_calibration_data","message":"Calibration quality gate: insufficient eval sample size.","source":"forecast"},{"code":"insufficient_uncertainty_data","message":"Uncertainty report has insufficient sample size.","source":"forecast"}],"run_id":"583bf7242ca75c73bc906a89a5b9e2c2"}