{"artifact_schema_version":"pipeline_run_artifact.v1","carry_through_hashes":{"calibration_hash":"cccccccccccccccccccccccccccccccccccccccccccccccccccccccccccccccc","dataset_hash":"bbbbbbbbbbbbbbbbbbbbbbbbbbbbbbbbbbbbbbbbbbbbbbbbbbbbbbbbbbbbbbbb","decision_payload_hash":"752504cf68248288f764b3920c09b7bb1665886ba0938c3cb592962b0e69acc4","decision_policy_hash":null,"forecast_payload_hash":"ffffffffffffffffffffffffffffffffffffffffffffffffffffffffffffffff","model_hash":"9999999999999999999999999999999999999999999999999999999999999999","trade_plan_payload_hash":"de4b0ed51cfb9abe0fd8c92cde2cb9d4824c9aacd916af669c83f1bf84c51af9","uncertainty_hash":"eeeeeeeeeeeeeeeeeeeeeeeeeeeeeeeeeeeeeeeeeeeeeeeeeeeeeeeeeeeeeeee"},"code_version":"93e488b02086","config_hash":"5d455c383bc62644856afe69193e85fa032eb04b230ed548e3887789dffa903a","generated_at_utc":"2026-02-01T00:00:00+00:00","inputs":{"forecast_artifact_hash":"ffffffffffffffffffffffffffffffffffffffffffffffffffffffffffffffff","forecast_artifact_path":"tests\\fixtures\\forecast\\forecast_artifact_sample.json","forecast_run_id":"forecast-run-sample"},"kpis":{"n_decisions":6,"n_orders":3,"n_positions":3,"n_rejected":0,"total_notional_usd":{"executed":75.0,"planned":75.0},"unrealized_pnl_usd":0.0},"outputs":{"decision":{"artifact_path":"artifacts\\decisions\\4b1f67b397d75781922dd5eabb1b5e7b.json","decision_items_hash":"68fbd141feb9d08a1343295625be3a1bfb0e6aab5c3b1d1fb00007e7ebb3692e","payload_hash":"752504cf68248288f764b3920c09b7bb1665886ba0938c3cb592962b0e69acc4","policy_hash":"2074697f10612fbec37d249bd72edd06c0c622b98c264c2bf117fc79e9c26d55","run_id":"4b1f67b397d75781922dd5eabb1b5e7b"},"execution":{"artifact_path":"artifacts\\executions\\063bfc4ee55e52a5a050a6fa749d009e.json","orders_hash":"7fb259e1b5bf0ab523fdcb798fb834b8058253ac5e025e8dd2a1bd7fe7f3391c","payload_hash":"95c1657d7aa7981aa17499da9e71420d5886f9e89f042b5553db451e142e0b71","policy_hash":"e71a4c6011253fd6715d40fe332811583f9a530f63abf309f1ede24956c1865a","run_id":"063bfc4ee55e52a5a050a6fa749d009e"},"portfolio":{"artifact_path":"artifacts\\portfolios\\bedfba2589365787b95cda410553e381.json","ledger_hash":"317d11cd6c1b9140d9ff71063823c78f715b8776e5e43258adc4896bccfe83ee","payload_hash":"d6e662f1fe07951a772e0a8d1ab17771d2de08bd19f650724a6784c96497d790","policy_hash":"b6199eaaa45dd159696d821fa9b8c9464f42cd0cd1a108475d0877728794097e","positions_hash":"aab70ae067c4f78dacef45b9a800c1d747d9682215dd14fba9e0c97b504eda86","run_id":"bedfba2589365787b95cda410553e381","valuation_hash":"4adbb20db3edba6c6e8d661a0e59da118268e5a6fb956c60caf33935f6c62a8d"},"trade_plan":{"artifact_path":"artifacts\\trade_plans\\99587b8cecbf59818561c19beb403a90.json","orders_hash":"eabc5e92fc7d9823e5373dc8f75373f5a5149d3bd44cd6ae99a0b0e46df2bf47","payload_hash":"de4b0ed51cfb9abe0fd8c92cde2cb9d4824c9aacd916af669c83f1bf84c51af9","policy_hash":"d58c1a0453df9f6a0e4ca970646c714f1a4c84a792d0ffd82ee1d3ef03f79fbd","run_id":"99587b8cecbf59818561c19beb403a90"}},"pipeline_outputs_hash":"84bcf60c82ca14c64c4ebe9ce7d7b9c5bf409458cf744136b19c9e5b00b1651f","pipeline_payload_hash":"839b67d65e855032f4987d8023d311db2ca5bc534ba6946436c8efb7b1058463","pipeline_policy_hash":"a3838416baf618b27a402d7cb47ee9657cb6139d8554517475eaae669b2646d5","pipeline_policy_version":"pipeline_stub.v1","quality_flags":["illiquid"],"quality_warnings":[{"code":"illiquid","message":"Top depth below threshold.","source":"decision_item"},{"code":"illiquid","message":"Top depth below threshold.","source":"execution_skipped"},{"code":"illiquid","message":"Top depth below threshold.","source":"trade_plan_skipped"}],"run_id":"c7571290ab9a5c198b8e1a5b3632d604"}