{"artifact_schema_version":"pipeline_run_artifact.v1","carry_through_hashes":{"calibration_hash":"4f53cda18c2baa0c0354bb5f9a3ecbe5ed12ab4d8e11ba873c2f11161202b945","dataset_hash":"4f53cda18c2baa0c0354bb5f9a3ecbe5ed12ab4d8e11ba873c2f11161202b945","decision_payload_hash":"fd91cc39434a0e38c20e8d5640bb1a233df2bd9f67d96a653c480265a01c6ec9","decision_policy_hash":null,"forecast_payload_hash":"4f53cda18c2baa0c0354bb5f9a3ecbe5ed12ab4d8e11ba873c2f11161202b945","model_hash":"5fefc094e744f012e566c8ecad5bf2331b43068d1c65056af8d72a621d6fa7de","trade_plan_payload_hash":"c0b69bd09729bf2136a02d9c7ded8679228ca9a100252e9bea175bbaa28753c2","uncertainty_hash":"4f53cda18c2baa0c0354bb5f9a3ecbe5ed12ab4d8e11ba873c2f11161202b945"},"code_version":"93e488b02086","config_hash":"5212fc207f8a49791cdacb4ba8cad6948204c282ffe325d5a1e95c49a1f258bd","generated_at_utc":"2026-02-16T06:22:13+00:00","inputs":{"forecast_artifact_hash":"4f53cda18c2baa0c0354bb5f9a3ecbe5ed12ab4d8e11ba873c2f11161202b945","forecast_artifact_path":"artifacts\\forecasts\\916a36568aa957fa9695fa7efbc244c9.json","forecast_run_id":"916a36568aa957fa9695fa7efbc244c9"},"kpis":{"n_decisions":0,"n_orders":0,"n_positions":0,"n_rejected":0,"total_notional_usd":{"executed":0.0,"planned":0.0},"unrealized_pnl_usd":0.0},"outputs":{"decision":{"artifact_path":"artifacts\\decisions\\a007d1a8cdfb5786a347c07025f77b3d.json","decision_items_hash":"4f53cda18c2baa0c0354bb5f9a3ecbe5ed12ab4d8e11ba873c2f11161202b945","payload_hash":"fd91cc39434a0e38c20e8d5640bb1a233df2bd9f67d96a653c480265a01c6ec9","policy_hash":"2074697f10612fbec37d249bd72edd06c0c622b98c264c2bf117fc79e9c26d55","run_id":"a007d1a8cdfb5786a347c07025f77b3d"},"execution":{"artifact_path":"artifacts\\executions\\e8ec14b3f652540b90d89787f83d8ced.json","orders_hash":"4f53cda18c2baa0c0354bb5f9a3ecbe5ed12ab4d8e11ba873c2f11161202b945","payload_hash":"852e00b96c61c71933842a175de46184fbef595e447aa9c7ced77a8cd3871e99","policy_hash":"e71a4c6011253fd6715d40fe332811583f9a530f63abf309f1ede24956c1865a","run_id":"e8ec14b3f652540b90d89787f83d8ced"},"portfolio":{"artifact_path":"artifacts\\portfolios\\d905a7bcd0b75ba690f585276b979bf3.json","ledger_hash":"4f53cda18c2baa0c0354bb5f9a3ecbe5ed12ab4d8e11ba873c2f11161202b945","payload_hash":"35245b1fb5feb026dfdfc2e6e2946a5010f8b0d85f5e98bf49f2c2d7353f1126","policy_hash":"b6199eaaa45dd159696d821fa9b8c9464f42cd0cd1a108475d0877728794097e","positions_hash":"4f53cda18c2baa0c0354bb5f9a3ecbe5ed12ab4d8e11ba873c2f11161202b945","run_id":"d905a7bcd0b75ba690f585276b979bf3","valuation_hash":"915be4968aa94c4bdd2e3fb927e6c2813327cf54c95e95227ace34cb2051538b"},"trade_plan":{"artifact_path":"artifacts\\trade_plans\\99c96ea5a48956808365543981fdd3bd.json","orders_hash":"4f53cda18c2baa0c0354bb5f9a3ecbe5ed12ab4d8e11ba873c2f11161202b945","payload_hash":"c0b69bd09729bf2136a02d9c7ded8679228ca9a100252e9bea175bbaa28753c2","policy_hash":"d58c1a0453df9f6a0e4ca970646c714f1a4c84a792d0ffd82ee1d3ef03f79fbd","run_id":"99c96ea5a48956808365543981fdd3bd"}},"pipeline_outputs_hash":"c7b7803038cbd9225ab3920a5636462a07c2fbbae884bc72aff2dcfb959701bb","pipeline_payload_hash":"0b74f32b9b2ba9a7b8c06ad472ee97d002bb7145693843196490c7bdc4ec69d9","pipeline_policy_hash":"a3838416baf618b27a402d7cb47ee9657cb6139d8554517475eaae669b2646d5","pipeline_policy_version":"pipeline_stub.v1","quality_flags":["coverage_below_target_50","coverage_below_target_90","insufficient_calibration_data","insufficient_uncertainty_data"],"quality_warnings":[{"code":"coverage_below_target_50","message":"Observed 50% interval coverage below target.","source":"forecast"},{"code":"coverage_below_target_90","message":"Observed 90% interval coverage below target.","source":"forecast"},{"code":"insufficient_calibration_data","message":"Calibration quality gate: insufficient eval sample size.","source":"forecast"},{"code":"insufficient_uncertainty_data","message":"Uncertainty report has insufficient sample size.","source":"forecast"}],"run_id":"4952729ce45953aca42db3a74b5c4491"}