{"artifact_schema_version":"pipeline_run_artifact.v1","carry_through_hashes":{"calibration_hash":"cccccccccccccccccccccccccccccccccccccccccccccccccccccccccccccccc","dataset_hash":"bbbbbbbbbbbbbbbbbbbbbbbbbbbbbbbbbbbbbbbbbbbbbbbbbbbbbbbbbbbbbbbb","decision_payload_hash":"9ffb9530d57265bb776d9d6d14d67c47d61fbd2e3ee44ccd4e86db1e7d6d0c66","decision_policy_hash":null,"forecast_payload_hash":"ffffffffffffffffffffffffffffffffffffffffffffffffffffffffffffffff","model_hash":"9999999999999999999999999999999999999999999999999999999999999999","trade_plan_payload_hash":"bfee8ab1044ef038b05cd3025015677365be45086a038281830bfb6c8e079064","uncertainty_hash":"eeeeeeeeeeeeeeeeeeeeeeeeeeeeeeeeeeeeeeeeeeeeeeeeeeeeeeeeeeeeeeee"},"code_version":"93e488b02086","config_hash":"5d455c383bc62644856afe69193e85fa032eb04b230ed548e3887789dffa903a","generated_at_utc":"2026-02-01T00:00:00+00:00","inputs":{"forecast_artifact_hash":"ffffffffffffffffffffffffffffffffffffffffffffffffffffffffffffffff","forecast_artifact_path":"tests\\fixtures\\forecast\\forecast_artifact_sample.json","forecast_run_id":"forecast-run-sample"},"kpis":{"n_decisions":6,"n_orders":3,"n_positions":3,"n_rejected":0,"total_notional_usd":{"executed":75.0,"planned":75.0},"unrealized_pnl_usd":0.0},"outputs":{"decision":{"artifact_path":"artifacts\\decisions\\eff7a9d4527e5f08a19b23483d411215.json","decision_items_hash":"68fbd141feb9d08a1343295625be3a1bfb0e6aab5c3b1d1fb00007e7ebb3692e","payload_hash":"9ffb9530d57265bb776d9d6d14d67c47d61fbd2e3ee44ccd4e86db1e7d6d0c66","policy_hash":"2074697f10612fbec37d249bd72edd06c0c622b98c264c2bf117fc79e9c26d55","run_id":"eff7a9d4527e5f08a19b23483d411215"},"execution":{"artifact_path":"artifacts\\executions\\5d0f88ea879c5ba2a1b03a1c30480e17.json","orders_hash":"dca4cf8414a56953c20185759a7d989116f9d4d714da2477e6be192352da5f27","payload_hash":"0645907a1368e53f5af0375e277cd3cf1d25931a1c419f17c835285822195b99","policy_hash":"e71a4c6011253fd6715d40fe332811583f9a530f63abf309f1ede24956c1865a","run_id":"5d0f88ea879c5ba2a1b03a1c30480e17"},"portfolio":{"artifact_path":"artifacts\\portfolios\\38eb02ea3f37503a9809e8e044d244ca.json","ledger_hash":"661dc7c2610bcbf7fa37235b560952c8d456442469e335cc577d5d807fddd689","payload_hash":"75187f5aca12e478497947daa5d88e2fb5d9e41f5b5626dd6557e0f103376354","policy_hash":"b6199eaaa45dd159696d821fa9b8c9464f42cd0cd1a108475d0877728794097e","positions_hash":"aab70ae067c4f78dacef45b9a800c1d747d9682215dd14fba9e0c97b504eda86","run_id":"38eb02ea3f37503a9809e8e044d244ca","valuation_hash":"4adbb20db3edba6c6e8d661a0e59da118268e5a6fb956c60caf33935f6c62a8d"},"trade_plan":{"artifact_path":"artifacts\\trade_plans\\5773412fa8cb5687b5832542b7c65ad4.json","orders_hash":"eabc5e92fc7d9823e5373dc8f75373f5a5149d3bd44cd6ae99a0b0e46df2bf47","payload_hash":"bfee8ab1044ef038b05cd3025015677365be45086a038281830bfb6c8e079064","policy_hash":"d58c1a0453df9f6a0e4ca970646c714f1a4c84a792d0ffd82ee1d3ef03f79fbd","run_id":"5773412fa8cb5687b5832542b7c65ad4"}},"pipeline_outputs_hash":"b92e7a38b0c4c65ee2e94c31452deda7884664c74faefeb56f5758cf27004fff","pipeline_payload_hash":"3e0aac01d441d2da92c220f1bdfa99c20254f55198ee342ba3fb9a1d99a42558","pipeline_policy_hash":"a3838416baf618b27a402d7cb47ee9657cb6139d8554517475eaae669b2646d5","pipeline_policy_version":"pipeline_stub.v1","quality_flags":["illiquid"],"quality_warnings":[{"code":"illiquid","message":"Top depth below threshold.","source":"decision_item"},{"code":"illiquid","message":"Top depth below threshold.","source":"execution_skipped"},{"code":"illiquid","message":"Top depth below threshold.","source":"trade_plan_skipped"}],"run_id":"6660927e5b6154c0a9688890518fc7d9"}